{
  "$schema": "./project-config.schema.json",
  "project_name": "{PROJECT_NAME}",
  "schema_version": "2.0.0",
  "cto_mode": "VIRTUAL",
  "cto_mode_options": {
    "VIRTUAL": "Virtual CTO acts as technical interface and delivery coordinator; shields user from technical trivia.",
    "USER": "User acts as CTO; coordinator presents concrete technical proposals, ADRs, and release candidates for direct user decision."
  },
  "delegated_authorities": {
    "allow_merge_integration": true,
    "allow_merge_production": false,
    "allow_deploy_production": false,
    "allow_infra_provisioning": false,
    "allow_destructive_operations": false,
    "allow_schema_migrations": true,
    "allow_dependency_updates": true
  },
  "git_policy": {
    "production_branch": "main",
    "integration_branch": "development",
    "branch_naming_patterns": {
      "feature": "feature/{task-id}/{dd.mm.yyyy}/{agent}",
      "bug": "bug/{bug-id}/{dd.mm.yyyy}/{agent}",
      "hotfix": "hotfix/{task-id}/{dd.mm.yyyy}/{agent}"
    },
    "worktrees_enabled": true
  },
  "quality_gates": {
    "test_coverage_threshold_percent": 80,
    "require_peer_code_review": true,
    "require_qa_signoff": true,
    "blocking_defect_severities": [
      "Critical",
      "Major"
    ]
  },
  "paths": {
    "vault_relative_path": "vault",
    "sessions_relative_path": ".it-department/sessions",
    "worktrees_relative_path": ".it-department/worktrees"
  },
  "security": {
    "production_secrets_agent_access": false,
    "test_secrets_agent_managed": true,
    "commit_real_credentials": false
  },
  "efficiency": {
    "audit_interval_days": 2,
    "audit_model": "claude-fable-5-1",
    "report_language": "English",
    "rules": {
      "R1_builds_per_fix_round_max": 2,
      "R2_screenshots_per_scenario_max": 10,
      "R2_screenshot_scale": 0.5,
      "R3_full_suite_runs_per_candidate_max": 1,
      "R4_summary_lines_max": 10,
      "R4_log_tail_lines": 40,
      "R4_tool_result_tokens_max": 2000,
      "R5_queue_wait_minutes_max": 5,
      "R5_split_jobs_longer_than_minutes": 10
    },
    "token_weights": {
      "input": 1,
      "cache_write": 2,
      "cache_read": 0.1,
      "output": 5
    },
    "ledger_path": ".it-department/sessions/_usage/ledger",
    "jobs_log_path": ".it-department/jobs",
    "reports_path": "vault/05-Reports"
  }
}
